{
  "contractVersion": 1,
  "id": "throughput-recovery-summary-desktop",
  "intentDigest": "sha256:5555555555555555555555555555555555555555555555555555555555555e",
  "artifactType": "html",
  "location": "test/fixtures/creative-assets-sample/artifact-unapproved/visual.html",
  "artifactDigest": "sha256:b019af70f0904baf7da51481f5d25a84557586cbc2f76402f5a6493a1448b33e",
  "createdAt": "2026-08-11T00:10:00.000Z",
  "generation": {
    "sourceSystem": "creative-generation-fixture"
  },
  "approval": {
    "status": "pending",
    "source": "creative-generation-fixture"
  }
}
