{
  "contractVersion": 1,
  "id": "approval-chain-status-desktop",
  "intentDigest": "sha256:3333333333333333333333333333333333333333333333333333333333333c",
  "artifactType": "html",
  "location": "test/fixtures/creative-assets-sample/artifact-b/visual.html",
  "artifactDigest": "sha256:827cf77db73a4e34d3ee1f40f4d3eafc5f7874c1208928703f2c07250b4051ba",
  "createdAt": "2026-08-11T00:05:00.000Z",
  "generation": {
    "sourceSystem": "creative-generation-fixture"
  },
  "approval": {
    "status": "approved",
    "source": "creative-generation-fixture"
  }
}
